{
  "body_top": 142.0,
  "body_bottom": 788.0,
  "name_left": 37.0,
  "name_right": 137.3,
  "level_kan": 46.6,
  "level_kou": 55.2,
  "budget_edges": [
    [
      137.3,
      204.4
    ],
    [
      204.4,
      271.6
    ],
    [
      271.6,
      333.7
    ],
    [
      333.7,
      392.2
    ],
    [
      392.2,
      459.4
    ]
  ],
  "budget": [
    "当初予算額",
    "補正予算額",
    "継続費及び繰越事業費繰越額",
    "予備費支出及び流用増減",
    "計"
  ],
  "setsu_left": 459.4,
  "setsu_right": 574.6,
  "exec_edges": [
    [
      630.0,
      725.4
    ],
    [
      725.4,
      792.5
    ],
    [
      792.5,
      848.2
    ],
    [
      848.2,
      906.7
    ],
    [
      906.7,
      961.0
    ],
    [
      961.0,
      1023.8
    ]
  ],
  "executed": [
    "金額",
    "支出済額",
    "継続費逓次繰越",
    "繰越明許費",
    "事故繰越し",
    "不用額"
  ],
  "note_left": 961.0,
  "note_right": 1154.5,
  "sum_kan": [
    36.0,
    210.1
  ],
  "sum_kou": [
    210.1,
    384.2
  ],
  "sum_edges": [
    [
      384.2,
      558.3
    ],
    [
      638.7,
      772.6
    ],
    [
      772.6,
      899.9
    ],
    [
      899.9,
      1027.1
    ],
    [
      1027.1,
      1154.3
    ]
  ],
  "sum_columns": [
    "予算現額",
    "支出済額",
    "翌年度繰越額",
    "不用額",
    "比較"
  ],
  "sum_body_top": 125.0
}
